{
  "$schema": "http://json-schema.org/draft-07/schema#",
  "type": "object",
  "required": ["candidate", "binary", "function", "status"],
  "properties": {
    "candidate": {"type": "string", "enum": ["libavoid","hola","ogdf","domus","ogdf_libavoid","sugiyama_libavoid","ogdf_planarization"]},
    "binary": {"type": "string"},
    "function": {"type": "string"},
    "status": {"type": "string", "enum": ["ok","error","timeout","deferred","crashed"]},
    "error_message": {"type": "string"},
    "machine": {"type": "object", "properties": {"cpu":{"type":"string"},"ram_gb":{"type":"number"},"os":{"type":"string"}}},
    "metrics": {
      "type": "object",
      "additionalProperties": false,
      "properties": {
        "edge_crossings": {"type":"number"},
        "total_edge_length": {"type":"number"},
        "runtime_ms": {"type":"number"},
        "bend_count": {"type":"number"},
        "bbox_area": {"type":"number"},
        "bbox_aspect": {"type":"number"},
        "port_violations": {"type":"number"},
        "edge_overlaps": {"type":"number"},
        "same_instr_cluster_dist": {"type":"number"},
        "orthogonal_segment_ratio": {"type": ["number", "null"], "minimum": 0, "maximum": 1, "description": "Fraction of polyline segments that are axis-aligned (within _ORTHO_TOL=1e-6). 1.0 = fully orthogonal."}
      }
    },
    "outputs": {
      "type": "object",
      "properties": {
        "png_path": {"type":"string"},
        "svg_path": {"type":"string"}
      }
    }
  },
  "additionalProperties": false
}
