{
  "binary": "large_nested",
  "candidate": "ogdf_libavoid",
  "function": "<auto>",
  "machine": {
    "cpu": "x86_64",
    "os": "Linux 6.19.8-arch1-1",
    "ram_gb": 30.83
  },
  "metrics": {
    "bbox_area": 9673533.950617285,
    "bbox_aspect": 1.5970654627539504,
    "bend_count": 246.0,
    "edge_crossings": 509.0,
    "edge_overlaps": 17.0,
    "orthogonal_segment_ratio": 1.0,
    "port_violations": 195.0,
    "runtime_ms": 1702.9450229601935,
    "same_instr_cluster_dist": 461.9594445569582,
    "total_edge_length": 138328.63624878685
  },
  "outputs": {
    "png_path": "/home/patacca/patacca_git/flatline/benchmarks/xray_layout/out/renders/large_nested__ogdf_libavoid.png"
  },
  "status": "ok"
}