{
  "binary": "xlarge_state_machine",
  "candidate": "hola",
  "error_message": "Layout exceeded shell-enforced wall clock (>300s); native solver did not honor SIGALRM",
  "function": "<auto>",
  "machine": {
    "cpu": "x86_64",
    "os": "Linux 6.19.8-arch1-1",
    "ram_gb": 30.83
  },
  "status": "timeout"
}
