{
  "binary": "xlarge_state_machine",
  "candidate": "sugiyama_libavoid",
  "error_message": "hard wall-clock timeout after 300s; killed worker process group",
  "function": "<auto>",
  "machine": {
    "cpu": "x86_64",
    "os": "Linux 6.19.8-arch1-1",
    "ram_gb": 30.83
  },
  "status": "timeout"
}