{
  "binary": "xlarge_state_machine",
  "candidate": "libavoid",
  "function": "<auto>",
  "machine": {
    "cpu": "x86_64",
    "os": "Linux 6.19.8-arch1-1",
    "ram_gb": 30.83
  },
  "metrics": {
    "bbox_area": 3648000.0,
    "bbox_aspect": 1.5789473684210527,
    "bend_count": 0.0,
    "edge_crossings": 61788.0,
    "edge_overlaps": 490.0,
    "port_violations": 344.0,
    "runtime_ms": 120.56170194409788,
    "same_instr_cluster_dist": 1098.328431871335,
    "total_edge_length": 944720.0
  },
  "outputs": {
    "png_path": "/home/patacca/patacca_git/flatline/benchmarks/xray_layout/out/renders/xlarge_state_machine__libavoid.png"
  },
  "status": "ok"
}